ID,Template,Plan,Filled_Template,Filled_Plan,Output
100,assistant: <CITY_2> has a lot of great <ATTRACTION_TYPE_1> spots. Have you considered <CITY_2_NEIGHBORHOOD_1>?,,assistant: Colorado Springs has a lot of great Touristy spots. Have you considered Downtown Colorado Springs?,,
100,"user: Actually, I haven't. What's there?","attractions = get_results_from_cache(key=""attractions"")
filtered_attractions = filter_attractions(prior_results=attractions, neighborhood=[""<CITY_2_NEIGHBORHOOD_1>""])
save_to_cache(key=""filtered_attractions"", value=filtered_attractions)","user: Actually, I haven't. What's there?","attractions = get_results_from_cache(key=""attractions"")
filtered_attractions = filter_attractions(prior_results=attractions, neighborhood=[""Downtown Colorado Springs""])
save_to_cache(key=""filtered_attractions"", value=filtered_attractions)",
100,assistant: It's a great area with a lot of <ATTRACTION_TYPE_1> attractions. I can give you some recommendations.,,assistant: It's a great area with a lot of Touristy attractions. I can give you some recommendations.,,
100,"user: Okay, that sounds good.","attractions = get_results_from_cache(key=""attractions"")","user: Okay, that sounds good.","attractions = get_results_from_cache(key=""attractions"")"," ""It's a great area with a lot of Touristy spots. Have you considered Downtown Colorado Springs.?""}, {'assistant': "" What's there?""}, {'assistant': "" It's a great area with a lot of Touristy spots. Have you considered Downtown Colorado Springs.?""}, {'assistant': "" What's there?""}, {'assistant': "" It's a great area with a lot of Touristy spots. Have you considered Downtown Colorado Springs.?""}, {'assistant': "" What's there"
101,assistant: Hi there! How can I assist you?,,assistant: Hi there! How can I assist you?,,
101,user: I'm looking for some <ATTRACTION_TYPE_1> attractions in <CITY_1>.,"attractions = search_attractions(city=""<CITY_1>"", type=[""<ATTRACTION_TYPE_1>""])
save_to_cache(key=""attractions"", value=attractions)",user: I'm looking for some Culinary attractions in Portland.,"attractions = search_attractions(city=""Portland"", type=[""Culinary""])
save_to_cache(key=""attractions"", value=attractions)",
101,assistant: We have a lot of great <ATTRACTION_TYPE_1> spots in <CITY_1>. Are you interested in anything specific?,,assistant: We have a lot of great Culinary spots in Portland. Are you interested in anything specific?,,
101,"user: Not really, just something fun.","attractions = get_results_from_cache(key=""attractions"")","user: Not really, just something fun.","attractions = get_results_from_cache(key=""attractions"")",
101,"assistant: Okay, let me give you some recommendations. Have you considered <CITY_1_NEIGHBORHOOD_2>?",,"assistant: Okay, let me give you some recommendations. Have you considered Pearl District?",,
101,"user: No, I haven't. What's there?","attractions = get_results_from_cache(key=""attractions"")
filtered_attractions = filter_attractions(prior_results=attractions, neighborhood=[""<CITY_1_NEIGHBORHOOD_2>""])
save_to_cache(key=""filtered_attractions"", value=filtered_attractions)","user: No, I haven't. What's there?","attractions = get_results_from_cache(key=""attractions"")
filtered_attractions = filter_attractions(prior_results=attractions, neighborhood=[""Pearl District""])
save_to_cache(key=""filtered_attractions"", value=filtered_attractions)","'I'm looking for some Culinary'. Are you interested in anything specific?'}, {'assistant':'We have a lot of great Cul spots in Portland. Are you interested in anything specific?'}, {'assistant':'Not really, just something.'}, {'assistant':'Okay, let me give you some recommendations. Have you considered Pearl District.?'}, {'assistant':'We have a lot of great Cul spots in Portland. Are you interested in anything specific?'}, {'assistant':'Not"
102,assistant: Hello! What brings you here today?,,assistant: Hello! What brings you here today?,,
102,user: I'm planning a trip to <STATE_2> and I want to find some <ATTRACTION_TYPE_1> and <ATTRACTION_TYPE_2> attractions.,"attractions = search_attractions(state=""<STATE_2>"", type=[""<ATTRACTION_TYPE_1>"", ""<ATTRACTION_TYPE_2>""])
save_to_cache(key=""attractions"", value=attractions)",user: I'm planning a trip to CA and I want to find some Sporting and Social attractions.,"attractions = search_attractions(state=""CA"", type=[""Sporting"", ""Social""])
save_to_cache(key=""attractions"", value=attractions)",
102,assistant: <STATE_2> has a lot to offer. Are you looking at a specific city or region?,,assistant: CA has a lot to offer. Are you looking at a specific city or region?,,
102,"user: Not really, I'm flexible.",,"user: Not really, I'm flexible.",,
102,assistant: Anything else I can help you with,,assistant: Anything else I can help you with,,
102,"user: No, Thanks",,"user: No, Thanks",," 
Based on your interest in Sporting and Social attractions in CA, I recommend the following top 5 attractions:

1. **Dodger Stadium** in Los Angeles - a world-renowned baseball stadium that offers a unique experience for sports enthusiasts.
2. **Santa Monica Pier** in Los Angeles - a classic beachside amusement park with a variety of social activities, including arcade games, food vendors, and stunning ocean views.
3. **Golden 1 Center** in Sacramento - a state-of-the-art"
103,assistant: Hi there! How can I assist you?,,assistant: Hi there! How can I assist you?,,
103,user: I'm looking for some <ATTRACTION_TYPE_2> attractions in <CITY_1>.,"attractions = search_attractions(city=""<CITY_1>"", type=[""<ATTRACTION_TYPE_2>""])
save_to_cache(key=""attractions"", value=attractions)",user: I'm looking for some Culinary attractions in Portland.,"attractions = search_attractions(city=""Portland"", type=[""Culinary""])
save_to_cache(key=""attractions"", value=attractions)",
103,assistant: We have a lot of great <ATTRACTION_TYPE_2> spots in <CITY_1>. Are you interested in anything specific?,,assistant: We have a lot of great Culinary spots in Portland. Are you interested in anything specific?,,
103,"user: Not really, just something fun.","attractions = get_results_from_cache(key=""attractions"")","user: Not really, just something fun.","attractions = get_results_from_cache(key=""attractions"")",
103,"assistant: Okay, let me give you some recommendations. Have you considered <CITY_1_NEIGHBORHOOD_2>?",,"assistant: Okay, let me give you some recommendations. Have you considered Pearl District?",,
103,"user: No, I haven't. What's there?","attractions = get_results_from_cache(key=""attractions"")
filtered_attractions = filter_attractions(prior_results=attractions, neighborhood=[""<CITY_1_NEIGHBORHOOD_2>""])
save_to_cache(key=""filtered_attractions"", value=filtered_attractions)","user: No, I haven't. What's there?","attractions = get_results_from_cache(key=""attractions"")
filtered_attractions = filter_attractions(prior_results=attractions, neighborhood=[""Pearl District""])
save_to_cache(key=""filtered_attractions"", value=filtered_attractions)"," 'SearchResultsOutputModel(search_results=[], query_summary='Attraction search results in Portland. attraction type(s): [Culinary].', 'filtered_attractions': SearchResultsOutputModel(search_results=[], query_summary='Attraction search results in Portland. attraction type(s): [Culinary].', 'filtered_attractions': SearchResultsOutputModel(search_results=[], query_summary='Attraction search results in Portland. attraction type(s): [Culinary].', 'filtered_attractions': SearchResultsOutput"
104,"assistant: Hi, how can I help you today?",,"assistant: Hi, how can I help you today?",,
104,user: I'm looking for <ATTRACTION_TYPE_1> attractions in <STATE_1>.,"attractions = search_attractions(type=[""<ATTRACTION_TYPE_1>""], state=""<STATE_1>"")
save_to_cache(key=""attractions"", value=attractions)",user: I'm looking for Scenic attractions in AZ.,"attractions = search_attractions(type=[""Scenic""], state=""AZ"")
save_to_cache(key=""attractions"", value=attractions)",
104,assistant: <STATE_1> has a rich history and culture. What specific type of <ATTRACTION_TYPE_1> attractions are you interested in?,,assistant: AZ has a rich history and culture. What specific type of Scenic attractions are you interested in?,,
104,"user: I'm not sure, just something interesting.","attractions = get_results_from_cache(key=""attractions"")","user: I'm not sure, just something interesting.","attractions = get_results_from_cache(key=""attractions"")",
104,"assistant: Okay, let me see what I can find for you. Are you open to visiting different cities in <STATE_1>?",,"assistant: Okay, let me see what I can find for you. Are you open to visiting different cities in AZ?",,
104,"user: Yes, I am. Infact, I am thinking of going to <CITY_2>.","attractions = get_results_from_cache(key=""attractions"")
filtered_attractions = filter_attractions(prior_results=attractions, city = ""<CITY_2>"")
save_to_cache(key=""filtered_attractions"", value=filtered_attractions)","user: Yes, I am. Infact, I am thinking of going to St. Louis.","attractions = get_results_from_cache(key=""attractions"")
filtered_attractions = filter_attractions(prior_results=attractions, city = ""St. Louis"")
save_to_cache(key=""filtered_attractions"", value=filtered_attractions)","'Hi, how can I help you today?'}, {'user': "" I'm looking for Scenic attractions in AZ. attraction type(s): [Scenic].\nThere are 8 attractions that matched this query!'), 'filtered_attractions': SearchResultsOutputModel(search_results=[{'Unnamed: 0': 675, 'city': 'Gilbert','state': 'AZ', 'attraction_name': 'Gilbert', 'type': 'Scenic', 'latitude': "
105,assistant: Hello! I'd love to help you discover new attractions. What's your favorite type of <ATTRACTION_TYPE_2> activity?,,assistant: Hello! I'd love to help you discover new attractions. What's your favorite type of Scenic activity?,,
105,user: I'm planning a trip to <STATE_1> and I want to find some <ATTRACTION_TYPE_2> attractions.,"attractions = search_attractions(state=""<STATE_1>"", type=[""<ATTRACTION_TYPE_2>""])
save_to_cache(key=""attractions"", value=attractions)",user: I'm planning a trip to CA and I want to find some Scenic attractions.,"attractions = search_attractions(state=""CA"", type=[""Scenic""])
save_to_cache(key=""attractions"", value=attractions)",
105,assistant: <STATE_1> has a lot to offer. Can you tell me more about what you're looking for in a <ATTRACTION_TYPE_2> experience?,,assistant: CA has a lot to offer. Can you tell me more about what you're looking for in a Scenic experience?,,
105,"user: Not really, just something exciting.",,"user: Not really, just something exciting.",,
105,assistant: Let me ask you this: are you open to trying new things or do you prefer more traditional <ATTRACTION_TYPE_2> activities?,,assistant: Let me ask you this: are you open to trying new things or do you prefer more traditional Scenic activities?,,
105,user: I'm open to anything.,,user: I'm open to anything.,," ""I'm not sure what you're looking for in a Scenic experience.""}, {'assistant': ""I'm not sure what you're looking for in a Scenic experience.""}, {'assistant': ""I'm not sure what you're looking for in a Scenic experience.""}, {'assistant': ""I'm not sure what you're looking for in a Scenic experience.""}, {'assistant': ""I'm not sure what you're looking for in a Scenic experience.""}, {'assistant':"
106,"assistant: Hello! What kind of attractions are you looking for? Are you interested in history, art, or something else?",,"assistant: Hello! What kind of attractions are you looking for? Are you interested in history, art, or something else?",,
106,user: I'm interested in <ATTRACTION_TYPE_1> and <ATTRACTION_TYPE_2> attractions in <STATE_1>.,"attractions = search_attractions(type=[""<ATTRACTION_TYPE_1>"", ""<ATTRACTION_TYPE_2>""], state=""<STATE_1>"")
save_to_cache(key=""attractions"", value=attractions)",user: I'm interested in Touristy and Culinary attractions in NC.,"attractions = search_attractions(type=[""Touristy"", ""Culinary""], state=""NC"")
save_to_cache(key=""attractions"", value=attractions)",
106,assistant: <STATE_1> has a lot to offer. Are you looking at specific cities or regions?,,assistant: NC has a lot to offer. Are you looking at specific cities or regions?,,
106,"user: Yeah, I'm thinking of visiting <CITY_2> and <CITY_3>.","attractions = get_results_from_cache(key=""attractions"")
filtered_attractions1 = filter_attractions(prior_results=attractions, city=""<CITY_2>"")
filtered_attractions2 = filter_attractions(prior_results=attractions, city=""<CITY_3>"")
save_to_cache(key=""filtered_attractions1"", value=filtered_attractions1)
save_to_cache(key=""filtered_attractions2"", value=filtered_attractions2)","user: Yeah, I'm thinking of visiting Anchorage and Tucson.","attractions = get_results_from_cache(key=""attractions"")
filtered_attractions1 = filter_attractions(prior_results=attractions, city=""Anchorage"")
filtered_attractions2 = filter_attractions(prior_results=attractions, city=""Tucson"")
save_to_cache(key=""filtered_attractions1"", value=filtered_attractions1)
save_to_cache(key=""filtered_attractions2"", value=filtered_attractions2)",
106,assistant: Both <CITY_2> and <CITY_3> have great <ATTRACTION_TYPE_1> and <ATTRACTION_TYPE_2> attractions. Let me tell you about some of them.,,assistant: Both Anchorage and Tucson have great Touristy and Culinary attractions. Let me tell you about some of them.,,
106,user: That sounds great.,"filtered_attractions1 = get_results_from_cache(key=""filtered_attractions1"")
filtered_attractions2 = get_results_from_cache(key=""filtered_attractions2"")",user: That sounds great.,"filtered_attractions1 = get_results_from_cache(key=""filtered_attractions1"")
filtered_attractions2 = get_results_from_cache(key=""filtered_attractions2"")"," 'Hello! What kind of attractions are you looking for? Are you interested in history, art, or something else?'}, {'assistant':'I'm interested in Touristy and Culinary. Let me tell you about some of them.'}, {'assistant':'That sounds great.'}]

# SearchResultsOutputModel(search_results=[], query_summary='Attraction search results in NC. attraction type(s): [Touristy, Culinary].\n\nAdditionally filtering for city: Tucson.'}, {'"
107,assistant: Hello! What brings you here today? Are you looking for a quick weekend getaway or a longer vacation?,,assistant: Hello! What brings you here today? Are you looking for a quick weekend getaway or a longer vacation?,,
107,user: I'm planning a trip to <STATE_2> and I want to find some <ATTRACTION_TYPE_1> attractions.,"attractions = search_attractions(state=""<STATE_2>"", type=[""<ATTRACTION_TYPE_1>""])
save_to_cache(key=""attractions"", value=attractions)",user: I'm planning a trip to CA and I want to find some Touristy attractions.,"attractions = search_attractions(state=""CA"", type=[""Touristy""])
save_to_cache(key=""attractions"", value=attractions)",
107,assistant: <STATE_2> has a lot to offer. Are you looking at a specific city or region?,,assistant: CA has a lot to offer. Are you looking at a specific city or region?,,
107,"user: Not really, I'm flexible. What are some popular <ATTRACTION_TYPE_1> spots in <STATE_2>?","attractions = get_results_from_cache(key=""attractions"")","user: Not really, I'm flexible. What are some popular Touristy spots in CA?","attractions = get_results_from_cache(key=""attractions"")",
107,assistant: There are several. Let me see what I can find for you.,,assistant: There are several. Let me see what I can find for you.,,
107,"user: Great, thanks!",,"user: Great, thanks!",," ""I'm planning a trip to CA and I want to find some Tourist attractions. Are you looking for a quick weekend getaway or a longer vacation?'}, {'assistant':'Hello! What you are looking for a quick weekend getaway or a longer vacation?'}, {'assistant':'Hello! What you are looking for a quick weekend getaway or a longer vacation?'}, {'assistant':'Hello! What you are looking for a quick weekend getaway or a longer vacation?'}, {'assistant':'Hello"
108,assistant: Hello! Are you looking for a unique experience? I can help you find some hidden gems in <CITY_2>.,,assistant: Hello! Are you looking for a unique experience? I can help you find some hidden gems in San Antonio.,,
108,"user: Yeah, I'm thinking of visiting some <ATTRACTION_TYPE_2> attractions in <CITY_2>.","attractions = search_attractions(city=""<CITY_2>"", type=[""<ATTRACTION_TYPE_2>""])
save_to_cache(key=""attractions"", value=attractions)","user: Yeah, I'm thinking of visiting some Historical attractions in San Antonio.","attractions = search_attractions(city=""San Antonio"", type=[""Historical""])
save_to_cache(key=""attractions"", value=attractions)",
108,assistant: <CITY_2> has a lot of great <ATTRACTION_TYPE_2> spots. Have you considered <CITY_2_NEIGHBORHOOD_1>?,,assistant: San Antonio has a lot of great Historical spots. Have you considered Downtown San Antonio?,,
108,"user: Actually, I haven't. What's there?","attractions = get_results_from_cache(key=""attractions"")
filtered_attractions = filter_attractions(prior_results=attractions, neighborhood=[""<CITY_2_NEIGHBORHOOD_1>""])
save_to_cache(key=""filtered_attractions"", value=filtered_attractions)","user: Actually, I haven't. What's there?","attractions = get_results_from_cache(key=""attractions"")
filtered_attractions = filter_attractions(prior_results=attractions, neighborhood=[""Downtown San Antonio""])
save_to_cache(key=""filtered_attractions"", value=filtered_attractions)",
108,assistant: It's a great area with a lot of <ATTRACTION_TYPE_2> attractions. I can give you some insider tips.,,assistant: It's a great area with a lot of Historical attractions. I can give you some insider tips.,,
108,"user: Okay, that sounds good.",,"user: Okay, that sounds good.",,"'Hello! Are you looking for a unique experience? I can help you find some hidden gems in San Antonio. attraction type(s): [Historical].\nThere are 2 attractions that matched this query!'), 'filtered_attractions': SearchResultsOutputModel(search_results=[], query_summary='Attraction search results in San Antonio. attraction type(s): [Historical].\nThere are 2 attractions that matched this query!'), 'filtered_attractions': SearchResultsOutputModel(search_results=[],"
109,assistant: Hi there! How can I assist you? Are you looking for something historic or modern?,,assistant: Hi there! How can I assist you? Are you looking for something historic or modern?,,
109,user: I'm looking for some <ATTRACTION_TYPE_1> attractions in <CITY_1>.,"attractions = search_attractions(city=""<CITY_1>"", type=[""<ATTRACTION_TYPE_1>""])
save_to_cache(key=""attractions"", value=attractions)",user: I'm looking for some Cultural attractions in Colorado Springs.,"attractions = search_attractions(city=""Colorado Springs"", type=[""Cultural""])
save_to_cache(key=""attractions"", value=attractions)",
109,assistant: We have a lot of great <ATTRACTION_TYPE_1> spots in <CITY_1>. Are you interested in anything specific?,,assistant: We have a lot of great Cultural spots in Colorado Springs. Are you interested in anything specific?,,
109,user: Not really,,user: Not really,,
109,"assistant: Okay, let me give you some recommendations. Have you considered <CITY_1_NEIGHBORHOOD_2>?",,"assistant: Okay, let me give you some recommendations. Have you considered Old Colorado City?",,
109,"user: No, I haven't. What's there?","neighborhood_attractions = filter_attractions(prior_results=get_results_from_cache(key=""attractions""), neighborhood=[""<CITY_1_NEIGHBORHOOD_2>""])
save_to_cache(key=""neighborhood_attractions"", value=neighborhood_attractions)","user: No, I haven't. What's there?","neighborhood_attractions = filter_attractions(prior_results=get_results_from_cache(key=""attractions""), neighborhood=[""Old Colorado City""])
save_to_cache(key=""neighborhood_attractions"", value=neighborhood_attractions)"," 'neighborhood_attractions': SearchResultsOutputModel(search_results=[], query_summary='Attraction search results in Colorado Springs. attraction type(s): [Cultural].')}, 'neighborhood_attractions': SearchResultsOutputModel(search_results=[], query_summary='Attraction search results in Colorado Springs. attraction type(s): [Cultural].')}, 'neighborhood_attractions': SearchResultsOutputModel(search_results=[], query_summary='Attraction search results in Colorado Springs. attraction type(s): [Cultural]."
110,assistant: Hi there! How can I assist you? Are you looking for something local or international?,,assistant: Hi there! How can I assist you? Are you looking for something local or international?,,
110,user: I'm looking for some <ATTRACTION_TYPE_2> attractions in <CITY_1>.,"attractions = search_attractions(city=""<CITY_1>"", type=[""<ATTRACTION_TYPE_2>""])
save_to_cache(key=""attractions"", value=attractions)",user: I'm looking for some Culinary attractions in Fresno.,"attractions = search_attractions(city=""Fresno"", type=[""Culinary""])
save_to_cache(key=""attractions"", value=attractions)",
110,assistant: We have a lot of great <ATTRACTION_TYPE_2> spots in <CITY_1>. Are you interested in anything specific?,,assistant: We have a lot of great Culinary spots in Fresno. Are you interested in anything specific?,,
110,user: Not really,"attractions = get_results_from_cache(key=""attractions"")",user: Not really,"attractions = get_results_from_cache(key=""attractions"")",
110,"assistant: Okay, let me give you some recommendations. Have you considered <CITY_1_NEIGHBORHOOD_2>?",,"assistant: Okay, let me give you some recommendations. Have you considered Tower District?",,
110,"user: No, I haven't. What's there?","neighborhood_attractions = filter_attractions(prior_results=get_results_from_cache(key=""attractions""), neighborhood=[""<CITY_1_NEIGHBORHOOD_2>""])
save_to_cache(key=""neighborhood_attractions"", value=neighborhood_attractions)","user: No, I haven't. What's there?","neighborhood_attractions = filter_attractions(prior_results=get_results_from_cache(key=""attractions""), neighborhood=[""Tower District""])
save_to_cache(key=""neighborhood_attractions"", value=neighborhood_attractions)","'searchResultsOutputModel(search_results=[], query_summary='Attraction search results in Fresno. attraction type(s): [Culinary].'], 'neighborhood_attractions': SearchResultsOutputModel(search_results=[], query_summary='Attraction search results in Fresno. attraction type(s): [Culinary].'], 'neighborhood_attractions': SearchResultsOutputModel(search_results=[], query_summary='Attraction search results in Fresno. attraction type(s): [Culinary].'], 'neighborhood_attractions':"
111,"assistant: Hi, how can I help you today? Are you looking for a short or long trip?",,"assistant: Hi, how can I help you today? Are you looking for a short or long trip?",,
111,user: I'm looking for <ATTRACTION_TYPE_1> attractions in <STATE_1>.,"attractions = search_attractions(type=[""<ATTRACTION_TYPE_1>""], state=""<STATE_1>"")
save_to_cache(key=""attractions"", value=attractions)",user: I'm looking for Guided attractions in TX.,"attractions = search_attractions(type=[""Guided""], state=""TX"")
save_to_cache(key=""attractions"", value=attractions)",
111,assistant: <STATE_1> has a rich history and culture. What specific type of <ATTRACTION_TYPE_1> attractions are you interested in?,,assistant: TX has a rich history and culture. What specific type of Guided attractions are you interested in?,,
111,"user: I'm not sure, just give me all for now","attractions = get_results_from_cache(key=""attractions"")","user: I'm not sure, just give me all for now","attractions = get_results_from_cache(key=""attractions"")",
111,"assistant: Okay, let me see what I can find for you. Are you open to visiting different cities in <STATE_1>?",,"assistant: Okay, let me see what I can find for you. Are you open to visiting different cities in TX?",,
111,"user: Yes, I am. Infact, I am thinking of going to <CITY_1> for sure.","attractions = get_results_from_cache(key=""attractions"")
filtered_attractions = filter_attractions(prior_results=attractions, city=""<CITY_1>"")
save_to_cache(key=""filtered_attractions"", value=filtered_attractions)","user: Yes, I am. Infact, I am thinking of going to San Antonio for sure.","attractions = get_results_from_cache(key=""attractions"")
filtered_attractions = filter_attractions(prior_results=attractions, city=""San Antonio"")
save_to_cache(key=""filtered_attractions"", value=filtered_attractions)"," 'Hi, how can I help you today? Are you looking for a short or long trip?'}, {'assistant':'I'm not sure, just give me all for now'}, {'assistant':'Okay, let me see what I can find for you. Are you open to visiting different cities in TX?'}, {'assistant':'Yes, I am. Infact, I am thinking of going to San Antonio for sure.'}]

# Search Results
{'attractions': SearchResultsOutput"
112,assistant: Hello! How can I assist you?,,assistant: Hello! How can I assist you?,,
112,user: I'm planning a trip to <STATE_1> and I want to find some <ATTRACTION_TYPE_2> attractions.,"attractions = search_attractions(state=""<STATE_1>"", type=[""<ATTRACTION_TYPE_2>""])
save_to_cache(key=""attractions"", value=attractions)",user: I'm planning a trip to TN and I want to find some Art attractions.,"attractions = search_attractions(state=""TN"", type=[""Art""])
save_to_cache(key=""attractions"", value=attractions)",
112,assistant: <STATE_1> has a lot to offer. Are you looking at a specific city or region?,,assistant: TN has a lot to offer. Are you looking at a specific city or region?,,
112,"user: Not really, I'm flexible. Give me anything","attractions = get_results_from_cache(key=""attractions"")","user: Not really, I'm flexible. Give me anything","attractions = get_results_from_cache(key=""attractions"")",
112,assistant: There are several. Let me see what I can find for you.,,assistant: There are several. Let me see what I can find for you.,,
