ID,Template,Plan,Filled_Template,Filled_Plan,Output
163,assistant: We have a lot of great <ATTRACTION_TYPE_2> spots in <CITY_1>. Are you interested in anything specific?,,assistant: We have a lot of great Social spots in Tucson. Are you interested in anything specific?,,
163,"user: Not really, just something fun.","attractions = get_results_from_cache(key=""attractions"")","user: Not really, just something fun.","attractions = get_results_from_cache(key=""attractions"")",
163,"assistant: Okay, let me give you some recommendations. Have you considered <CITY_1_NEIGHBORHOOD_2>?",,"assistant: Okay, let me give you some recommendations. Have you considered 4th Avenue?",,
163,"user: No, I haven't. What's there?","attractions = get_results_from_cache(key=""attractions"")
filtered_attractions = filter_attractions(prior_results=attractions, neighborhood=[""<CITY_1_NEIGHBORHOOD_2>""])
save_to_cache(key=""filtered_attractions"", value=filtered_attractions)","user: No, I haven't. What's there?","attractions = get_results_from_cache(key=""attractions"")
filtered_attractions = filter_attractions(prior_results=attractions, neighborhood=[""4th Avenue""])
save_to_cache(key=""filtered_attractions"", value=filtered_attractions)","'What's there?'}, {'assistant':'We have a lot of great Social spots in Tucson. Are you interested in anything specific?'}, {'assistant':'Not really, just something.'}, {'assistant':'We have a lot of great Social spots in Tucson. Are you interested in anything specific?'}, {'assistant':'Not really, just something.'}, {'assistant':'We have a lot of great Social spots in Tucson. Are you interested in anything specific?'}, {'assistant':"
164,"assistant: Hi, how can I help you today?",,"assistant: Hi, how can I help you today?",,
164,user: I'm looking for <ATTRACTION_TYPE_1> attractions in <STATE_1>.,"attractions = search_attractions(type=[""<ATTRACTION_TYPE_1>""], state=""<STATE_1>"")
save_to_cache(key=""attractions"", value=attractions)",user: I'm looking for Guided attractions in NV.,"attractions = search_attractions(type=[""Guided""], state=""NV"")
save_to_cache(key=""attractions"", value=attractions)",
164,assistant: <STATE_1> has a rich history and culture. What specific type of <ATTRACTION_TYPE_1> attractions are you interested in?,,assistant: NV has a rich history and culture. What specific type of Guided attractions are you interested in?,,
164,"user: I'm not sure, just something interesting.","attractions = get_results_from_cache(key=""attractions"")","user: I'm not sure, just something interesting.","attractions = get_results_from_cache(key=""attractions"")",
164,"assistant: Okay, let me see what I can find for you. Are you open to visiting different cities in <STATE_1>?",,"assistant: Okay, let me see what I can find for you. Are you open to visiting different cities in NV?",,
164,"user: Yes, I am. Infact, I am thinking of going to <CITY_2>.","attractions = get_results_from_cache(key=""attractions"")
filtered_attractions = filter_attractions(prior_results=attractions, city = ""<CITY_2>"")
save_to_cache(key=""filtered_attractions"", value=filtered_attractions)","user: Yes, I am. Infact, I am thinking of going to St. Louis.","attractions = get_results_from_cache(key=""attractions"")
filtered_attractions = filter_attractions(prior_results=attractions, city = ""St. Louis"")
save_to_cache(key=""filtered_attractions"", value=filtered_attractions)"," 'Hi, how can I help you today?'}, {'assistant':'I'm not, just something interesting.'}, {'assistant':'Okay, let me see what I can find for you. Are you open to visiting different cities in NV?'}, {'assistant':'Yes, I am. Infact, I am thinking of going to St. Louis.'}]

# SearchResults
{'attractions': SearchResultsOutputModel(search_results=[], query_summary='Attraction search results in NV."
165,assistant: Hello! I'd love to help you discover new attractions. What's your favorite type of <ATTRACTION_TYPE_2> activity?,,assistant: Hello! I'd love to help you discover new attractions. What's your favorite type of Scenic activity?,,
165,user: I'm planning a trip to <STATE_1> and I want to find some <ATTRACTION_TYPE_2> attractions.,"attractions = search_attractions(state=""<STATE_1>"", type=[""<ATTRACTION_TYPE_2>""])
save_to_cache(key=""attractions"", value=attractions)",user: I'm planning a trip to CA and I want to find some Scenic attractions.,"attractions = search_attractions(state=""CA"", type=[""Scenic""])
save_to_cache(key=""attractions"", value=attractions)",
165,assistant: <STATE_1> has a lot to offer. Can you tell me more about what you're looking for in a <ATTRACTION_TYPE_2> experience?,,assistant: CA has a lot to offer. Can you tell me more about what you're looking for in a Scenic experience?,,
165,"user: Not really, just something exciting.",,"user: Not really, just something exciting.",,
165,assistant: Let me ask you this: are you open to trying new things or do you prefer more traditional <ATTRACTION_TYPE_2> activities?,,assistant: Let me ask you this: are you open to trying new things or do you prefer more traditional Scenic activities?,,
165,user: I'm open to anything.,,user: I'm open to anything.,," 'I'm not sure what you mean by ""attraction type"".'}, {'assistant': 'I think you mean by ""Scenic"".'}, {'assistant': 'I think you mean by ""Scenic"".'}, {'assistant': 'I think you mean by ""Scenic"".'}, {'assistant': 'I think you mean by ""Scenic"".'}, {'assistant': 'I think you mean by ""Scenic"".'}, {'assistant': 'I think you mean by"
166,"assistant: Hello! What kind of attractions are you looking for? Are you interested in history, art, or something else?",,"assistant: Hello! What kind of attractions are you looking for? Are you interested in history, art, or something else?",,
166,user: I'm interested in <ATTRACTION_TYPE_1> and <ATTRACTION_TYPE_2> attractions in <STATE_1>.,"attractions = search_attractions(type=[""<ATTRACTION_TYPE_1>"", ""<ATTRACTION_TYPE_2>""], state=""<STATE_1>"")
save_to_cache(key=""attractions"", value=attractions)",user: I'm interested in Historical and Scenic attractions in TX.,"attractions = search_attractions(type=[""Historical"", ""Scenic""], state=""TX"")
save_to_cache(key=""attractions"", value=attractions)",
166,assistant: <STATE_1> has a lot to offer. Are you looking at specific cities or regions?,,assistant: TX has a lot to offer. Are you looking at specific cities or regions?,,
166,"user: Yeah, I'm thinking of visiting <CITY_2> and <CITY_3>.","attractions = get_results_from_cache(key=""attractions"")
filtered_attractions1 = filter_attractions(prior_results=attractions, city=""<CITY_2>"")
filtered_attractions2 = filter_attractions(prior_results=attractions, city=""<CITY_3>"")
save_to_cache(key=""filtered_attractions1"", value=filtered_attractions1)
save_to_cache(key=""filtered_attractions2"", value=filtered_attractions2)","user: Yeah, I'm thinking of visiting Raleigh and St. Louis.","attractions = get_results_from_cache(key=""attractions"")
filtered_attractions1 = filter_attractions(prior_results=attractions, city=""Raleigh"")
filtered_attractions2 = filter_attractions(prior_results=attractions, city=""St. Louis"")
save_to_cache(key=""filtered_attractions1"", value=filtered_attractions1)
save_to_cache(key=""filtered_attractions2"", value=filtered_attractions2)",
166,assistant: Both <CITY_2> and <CITY_3> have great <ATTRACTION_TYPE_1> and <ATTRACTION_TYPE_2> attractions. Let me tell you about some of them.,,assistant: Both Raleigh and St. Louis have great Historical and Scenic attractions. Let me tell you about some of them.,,
166,user: That sounds great.,"filtered_attractions1 = get_results_from_cache(key=""filtered_attractions1"")
filtered_attractions2 = get_results_from_cache(key=""filtered_attractions2"")",user: That sounds great.,"filtered_attractions1 = get_results_from_cache(key=""filtered_attractions1"")
filtered_attractions2 = get_results_from_cache(key=""filtered_attractions2"")"," 
The user is looking for attractions in Texas. The conversation is about Historical and Scenic attractions in TX. The assistant recommends several attractions that match the query. 

Here is the search results: 
{'attractions': [{'city': 'Houston','state': 'TX', 'attraction_name': 'Houston Arboretum and Nature Center', 'type': 'Scenic', 'latitude': 29.7652, 'longitude': -95.452, 'neighborhood': 'River"
167,assistant: Hello! What brings you here today? Are you looking for a quick weekend getaway or a longer vacation?,,assistant: Hello! What brings you here today? Are you looking for a quick weekend getaway or a longer vacation?,,
167,user: I'm planning a trip to <STATE_2> and I want to find some <ATTRACTION_TYPE_1> attractions.,"attractions = search_attractions(state=""<STATE_2>"", type=[""<ATTRACTION_TYPE_1>""])
save_to_cache(key=""attractions"", value=attractions)",user: I'm planning a trip to GA and I want to find some Touristy attractions.,"attractions = search_attractions(state=""GA"", type=[""Touristy""])
save_to_cache(key=""attractions"", value=attractions)",
167,assistant: <STATE_2> has a lot to offer. Are you looking at a specific city or region?,,assistant: GA has a lot to offer. Are you looking at a specific city or region?,,
167,"user: Not really, I'm flexible. What are some popular <ATTRACTION_TYPE_1> spots in <STATE_2>?","attractions = get_results_from_cache(key=""attractions"")","user: Not really, I'm flexible. What are some popular Touristy spots in GA?","attractions = get_results_from_cache(key=""attractions"")",
167,assistant: There are several. Let me see what I can find for you.,,assistant: There are several. Let me see what I can find for you.,,
167,"user: Great, thanks!",,"user: Great, thanks!",," ""I'm planning a trip to GA and I want to find some Touristy attractions.""}, {'assistant':'Hello! What you here today? Are you looking for a quick weekend getaway or a longer vacation?'}, {'assistant':'There are several. Let me see what I can find for you.'}, {'assistant':'Great, thanks!'}]

# Search
{'attractions': SearchResultsOutputModel(search_results=[{'Unnamed: 0': 377, 'city': '"
168,assistant: Hello! Are you looking for a unique experience? I can help you find some hidden gems in <CITY_2>.,,assistant: Hello! Are you looking for a unique experience? I can help you find some hidden gems in Portland.,,
168,"user: Yeah, I'm thinking of visiting some <ATTRACTION_TYPE_2> attractions in <CITY_2>.","attractions = search_attractions(city=""<CITY_2>"", type=[""<ATTRACTION_TYPE_2>""])
save_to_cache(key=""attractions"", value=attractions)","user: Yeah, I'm thinking of visiting some Sporting attractions in Portland.","attractions = search_attractions(city=""Portland"", type=[""Sporting""])
save_to_cache(key=""attractions"", value=attractions)",
168,assistant: <CITY_2> has a lot of great <ATTRACTION_TYPE_2> spots. Have you considered <CITY_2_NEIGHBORHOOD_1>?,,assistant: Portland has a lot of great Sporting spots. Have you considered Downtown Portland?,,
168,"user: Actually, I haven't. What's there?","attractions = get_results_from_cache(key=""attractions"")
filtered_attractions = filter_attractions(prior_results=attractions, neighborhood=[""<CITY_2_NEIGHBORHOOD_1>""])
save_to_cache(key=""filtered_attractions"", value=filtered_attractions)","user: Actually, I haven't. What's there?","attractions = get_results_from_cache(key=""attractions"")
filtered_attractions = filter_attractions(prior_results=attractions, neighborhood=[""Downtown Portland""])
save_to_cache(key=""filtered_attractions"", value=filtered_attractions)",
168,assistant: It's a great area with a lot of <ATTRACTION_TYPE_2> attractions. I can give you some insider tips.,,assistant: It's a great area with a lot of Sporting attractions. I can give you some insider tips.,,
168,"user: Okay, that sounds good.",,"user: Okay, that sounds good.",," 'Portland has a lot of great Sporting spots. Have you considered Downtown Portland.'}, {'assistant':'Portland has a lot of great Sporting spots. I can give you some insider information about Portland.}'

assistant: 'Portland has a lot of great Sporting spots. Have you considered Downtown Portland.}'}, {'assistant':'Portland has a lot of great Sporting spots. I can give you some insider information about Portland.}'

assistant: 'Portland has a lot of great Sporting spots. I"
169,assistant: Hi there! How can I assist you? Are you looking for something historic or modern?,,assistant: Hi there! How can I assist you? Are you looking for something historic or modern?,,
169,user: I'm looking for some <ATTRACTION_TYPE_1> attractions in <CITY_1>.,"attractions = search_attractions(city=""<CITY_1>"", type=[""<ATTRACTION_TYPE_1>""])
save_to_cache(key=""attractions"", value=attractions)",user: I'm looking for some Scenic attractions in Anchorage.,"attractions = search_attractions(city=""Anchorage"", type=[""Scenic""])
save_to_cache(key=""attractions"", value=attractions)",
169,assistant: We have a lot of great <ATTRACTION_TYPE_1> spots in <CITY_1>. Are you interested in anything specific?,,assistant: We have a lot of great Scenic spots in Anchorage. Are you interested in anything specific?,,
169,user: Not really,,user: Not really,,
169,"assistant: Okay, let me give you some recommendations. Have you considered <CITY_1_NEIGHBORHOOD_2>?",,"assistant: Okay, let me give you some recommendations. Have you considered Spenard?",,
169,"user: No, I haven't. What's there?","neighborhood_attractions = filter_attractions(prior_results=get_results_from_cache(key=""attractions""), neighborhood=[""<CITY_1_NEIGHBORHOOD_2>""])
save_to_cache(key=""neighborhood_attractions"", value=neighborhood_attractions)","user: No, I haven't. What's there?","neighborhood_attractions = filter_attractions(prior_results=get_results_from_cache(key=""attractions""), neighborhood=[""Spenard""])
save_to_cache(key=""neighborhood_attractions"", value=neighborhood_attractions)","'search_results':'search_results', 'neighborhood': 'Spenard', 'latitude': 61.22055556, 'longitude': -149.8975, 'neighborhood': 'Fairview',}, {'user': "" I'm looking for some Scenic attractions in Anchorage. attraction type(s): [Scenic].\nThere are 4 attractions that matched this query!'), 'neighborhood': 'Spenard', 'latitude': 61.22055556"
170,assistant: Hi there! How can I assist you? Are you looking for something local or international?,,assistant: Hi there! How can I assist you? Are you looking for something local or international?,,
170,user: I'm looking for some <ATTRACTION_TYPE_2> attractions in <CITY_1>.,"attractions = search_attractions(city=""<CITY_1>"", type=[""<ATTRACTION_TYPE_2>""])
save_to_cache(key=""attractions"", value=attractions)",user: I'm looking for some Social attractions in Las Vegas.,"attractions = search_attractions(city=""Las Vegas"", type=[""Social""])
save_to_cache(key=""attractions"", value=attractions)",
170,assistant: We have a lot of great <ATTRACTION_TYPE_2> spots in <CITY_1>. Are you interested in anything specific?,,assistant: We have a lot of great Social spots in Las Vegas. Are you interested in anything specific?,,
170,user: Not really,"attractions = get_results_from_cache(key=""attractions"")",user: Not really,"attractions = get_results_from_cache(key=""attractions"")",
170,"assistant: Okay, let me give you some recommendations. Have you considered <CITY_1_NEIGHBORHOOD_2>?",,"assistant: Okay, let me give you some recommendations. Have you considered Summerlin?",,
170,"user: No, I haven't. What's there?","neighborhood_attractions = filter_attractions(prior_results=get_results_from_cache(key=""attractions""), neighborhood=[""<CITY_1_NEIGHBORHOOD_2>""])
save_to_cache(key=""neighborhood_attractions"", value=neighborhood_attractions)","user: No, I haven't. What's there?","neighborhood_attractions = filter_attractions(prior_results=get_results_from_cache(key=""attractions""), neighborhood=[""Summerlin""])
save_to_cache(key=""neighborhood_attractions"", value=neighborhood_attractions)"," ""I'm looking for some Social attractions in Las Vegas. Are you interested in anything specific?'}, {'assistant':'We have a lot of great Social spots in Las Vegas. Are you looking for something local or international?'}, {'assistant':'Not really. What's there?'}, {'assistant':'I'm looking for some Social attractions in Las Vegas. Are you interested in anything specific?'}, {'assistant':'Not really. What's there?'}, {'assistant':'I'm looking"
171,"assistant: Hi, how can I help you today? Are you looking for a short or long trip?",,"assistant: Hi, how can I help you today? Are you looking for a short or long trip?",,
171,user: I'm looking for <ATTRACTION_TYPE_1> attractions in <STATE_1>.,"attractions = search_attractions(type=[""<ATTRACTION_TYPE_1>""], state=""<STATE_1>"")
save_to_cache(key=""attractions"", value=attractions)",user: I'm looking for Cultural attractions in MO.,"attractions = search_attractions(type=[""Cultural""], state=""MO"")
save_to_cache(key=""attractions"", value=attractions)",
171,assistant: <STATE_1> has a rich history and culture. What specific type of <ATTRACTION_TYPE_1> attractions are you interested in?,,assistant: MO has a rich history and culture. What specific type of Cultural attractions are you interested in?,,
171,"user: I'm not sure, just give me all for now","attractions = get_results_from_cache(key=""attractions"")","user: I'm not sure, just give me all for now","attractions = get_results_from_cache(key=""attractions"")",
171,"assistant: Okay, let me see what I can find for you. Are you open to visiting different cities in <STATE_1>?",,"assistant: Okay, let me see what I can find for you. Are you open to visiting different cities in MO?",,
171,"user: Yes, I am. Infact, I am thinking of going to <CITY_1> for sure.","attractions = get_results_from_cache(key=""attractions"")
filtered_attractions = filter_attractions(prior_results=attractions, city=""<CITY_1>"")
save_to_cache(key=""filtered_attractions"", value=filtered_attractions)","user: Yes, I am. Infact, I am thinking of going to St. Louis for sure.","attractions = get_results_from_cache(key=""attractions"")
filtered_attractions = filter_attractions(prior_results=attractions, city=""St. Louis"")
save_to_cache(key=""filtered_attractions"", value=filtered_attractions)","'searchResultsOutputModel(search_results=[{'Unnamed: 0': 391, 'city': 'Kansas City','state': 'MO', 'attraction_name': 'National of Toys and Miniatures', 'type': 'Cultural', 'latitude': 39.0308, 'longitude': -94.5822, 'neighborhood': 'West'}], query_summary='Attraction search results in MO. attraction type(s): [Cultural].\nThere are 1"
172,assistant: Hello! How can I assist you?,,assistant: Hello! How can I assist you?,,
172,user: I'm planning a trip to <STATE_1> and I want to find some <ATTRACTION_TYPE_2> attractions.,"attractions = search_attractions(state=""<STATE_1>"", type=[""<ATTRACTION_TYPE_2>""])
save_to_cache(key=""attractions"", value=attractions)",user: I'm planning a trip to CA and I want to find some Touristy attractions.,"attractions = search_attractions(state=""CA"", type=[""Touristy""])
save_to_cache(key=""attractions"", value=attractions)",
172,assistant: <STATE_1> has a lot to offer. Are you looking at a specific city or region?,,assistant: CA has a lot to offer. Are you looking at a specific city or region?,,
172,"user: Not really, I'm flexible. Give me anything","attractions = get_results_from_cache(key=""attractions"")","user: Not really, I'm flexible. Give me anything","attractions = get_results_from_cache(key=""attractions"")",
172,assistant: There are several. Let me see what I can find for you.,,assistant: There are several. Let me see what I can find for you.,,
172,"user: Great, thanks!",,"user: Great, thanks!",," 'I'm looking for attractions in the area around the city or region.', 'attraction_name': 'Aquatica San Diego', 'type': 'Touristy', 'latitude': 32.5884, 'longitude': -117.0101, 'neighborhood': 'Rancho del Rey'}], query_summary='Attraction search results in CA. attraction type(s): [Touristy].\nThere are 14 attractions that matched this query!')}

assistant: 'I'm"
173,assistant: Hello! Are you looking for something to do in your free time?,,assistant: Hello! Are you looking for something to do in your free time?,,
173,"user: Yeah, I'm thinking of visiting some <ATTRACTION_TYPE_1> attractions in <CITY_2>.","attractions = search_attractions(city=""<CITY_2>"", type=[""<ATTRACTION_TYPE_1>""])
save_to_cache(key=""attractions"", value=attractions)","user: Yeah, I'm thinking of visiting some Scenic attractions in Atlanta.","attractions = search_attractions(city=""Atlanta"", type=[""Scenic""])
save_to_cache(key=""attractions"", value=attractions)",
173,assistant: <CITY_2> has a lot of great <ATTRACTION_TYPE_1> spots. Have you considered <CITY_2_NEIGHBORHOOD_1>?,,assistant: Atlanta has a lot of great Scenic spots. Have you considered Midtown Atlanta?,,
173,"user: Actually, I haven't. What's there?","attractions = get_results_from_cache(key=""attractions"")
filtered_attractions = filter_attractions(prior_results=attractions, neighborhood=[""<CITY_2_NEIGHBORHOOD_1>""])
save_to_cache(key=""filtered_attractions"", value=filtered_attractions)","user: Actually, I haven't. What's there?","attractions = get_results_from_cache(key=""attractions"")
filtered_attractions = filter_attractions(prior_results=attractions, neighborhood=[""Midtown Atlanta""])
save_to_cache(key=""filtered_attractions"", value=filtered_attractions)",
173,assistant: It's a great area with a lot of <ATTRACTION_TYPE_1> attractions. I can give you some recommendations.,,assistant: It's a great area with a lot of Scenic attractions. I can give you some recommendations.,,
173,"user: Okay, that sounds good.","filtered_attractions = get_results_from_cache(key=""filtered_attractions"")","user: Okay, that sounds good.","filtered_attractions = get_results_from_cache(key=""filtered_attractions"")","'search_results': SearchResultsOutputModel(search_results=[{'Unnamed: 0': 379, 'city': 'Atlanta','state': 'GA', 'attraction_name': 'Piedmont Park', 'type': 'Scenic', 'latitude': 33.78611111, 'longitude': -84.37333333, 'neighborhood': 'Midtown Atlanta'}], query_summary='Attraction search results in Atlanta. attraction type(s): [Scenic].\n"
174,assistant: Hello! Are you looking for something to do in your free time?,,assistant: Hello! Are you looking for something to do in your free time?,,
174,"user: Yeah, I'm thinking of visiting some <ATTRACTION_TYPE_2> attractions in <CITY_2>.","attractions = search_attractions(city=""<CITY_2>"", type=[""<ATTRACTION_TYPE_2>""])
save_to_cache(key=""attractions"", value=attractions)","user: Yeah, I'm thinking of visiting some Guided attractions in Portland.","attractions = search_attractions(city=""Portland"", type=[""Guided""])
save_to_cache(key=""attractions"", value=attractions)",
174,assistant: <CITY_2> has a lot of great <ATTRACTION_TYPE_2> spots. Have you considered <CITY_2_NEIGHBORHOOD_1>?,,assistant: Portland has a lot of great Guided spots. Have you considered Downtown Portland?,,
174,"user: Actually, I haven't. What's there?","attractions = get_results_from_cache(key=""attractions"")
filtered_attractions = filter_attractions(prior_results=attractions, neighborhood=[""<CITY_2_NEIGHBORHOOD_1>""])
save_to_cache(key=""filtered_attractions"", value=filtered_attractions)","user: Actually, I haven't. What's there?","attractions = get_results_from_cache(key=""attractions"")
filtered_attractions = filter_attractions(prior_results=attractions, neighborhood=[""Downtown Portland""])
save_to_cache(key=""filtered_attractions"", value=filtered_attractions)",
174,assistant: It's a great area with a lot of <ATTRACTION_TYPE_2> attractions. I can give you some recommendations.,,assistant: It's a great area with a lot of Guided attractions. I can give you some recommendations.,,
174,"user: Okay, that sounds good.","filtered_attractions = get_results_from_cache(key=""filtered_attractions"")","user: Okay, that sounds good.","filtered_attractions = get_results_from_cache(key=""filtered_attractions"")","'Portland has a lot of great Guided spots. Have you considered Downtown Portland. What's there?'}, {'assistant':'Hello! Are you looking for something to do in your free time?'}, {'assistant':'Yeah, I'm not really. What's there?'}, {'assistant':'I'm not really. What's there?'}, {'assistant':'Yeah, I'm not really. What's there?'}, {'assistant':'I'm not really. What's there?'"
175,assistant: Hello! Are you looking for something to do in your free time?,,assistant: Hello! Are you looking for something to do in your free time?,,
175,"user: Yeah, I'm thinking of visiting some <ATTRACTION_TYPE_1> attractions in <CITY_2>.","attractions = search_attractions(city=""<CITY_2>"", type=[""<ATTRACTION_TYPE_1>""])
save_to_cache(key=""attractions"", value=attractions)","user: Yeah, I'm thinking of visiting some Historical attractions in Colorado Springs.","attractions = search_attractions(city=""Colorado Springs"", type=[""Historical""])
save_to_cache(key=""attractions"", value=attractions)",
175,assistant: <CITY_2> has a lot of great <ATTRACTION_TYPE_1> spots. Have you considered <CITY_2_NEIGHBORHOOD_1>?,,assistant: Colorado Springs has a lot of great Historical spots. Have you considered Downtown Colorado Springs?,,
175,"user: Actually, I haven't. What's there?","attractions = get_results_from_cache(key=""attractions"")
filtered_attractions = filter_attractions(prior_results=attractions, neighborhood=[""<CITY_2_NEIGHBORHOOD_1>""])
save_to_cache(key=""filtered_attractions"", value=filtered_attractions)","user: Actually, I haven't. What's there?","attractions = get_results_from_cache(key=""attractions"")
filtered_attractions = filter_attractions(prior_results=attractions, neighborhood=[""Downtown Colorado Springs""])
save_to_cache(key=""filtered_attractions"", value=filtered_attractions)",
