ID,Template,Plan,Filled_Template,Filled_Plan,Output
0,assistant: Hello! I'd love to help you discover new attractions. What's your favorite type of <ATTRACTION_TYPE_2> activity?,,assistant: Hello! I'd love to help you discover new attractions. What's your favorite type of Guided activity?,,
0,user: I'm planning a trip to <STATE_1> and I want to find some <ATTRACTION_TYPE_2> attractions.,"attractions = search_attractions(state=""<STATE_1>"", type=[""<ATTRACTION_TYPE_2>""])
save_to_cache(key=""attractions"", value=attractions)",user: I'm planning a trip to CO and I want to find some Guided attractions.,"attractions = search_attractions(state=""CO"", type=[""Guided""])
save_to_cache(key=""attractions"", value=attractions)",
0,assistant: <STATE_1> has a lot to offer. Can you tell me more about what you're looking for in a <ATTRACTION_TYPE_2> experience?,,assistant: CO has a lot to offer. Can you tell me more about what you're looking for in a Guided experience?,,
0,"user: Not really, just something exciting.",,"user: Not really, just something exciting.",,
0,assistant: Let me ask you this: are you open to trying new things or do you prefer more traditional <ATTRACTION_TYPE_2> activities?,,assistant: Let me ask you this: are you open to trying new things or do you prefer more traditional Guided activities?,,
0,user: I'm open to anything.,,user: I'm open to anything.,," "" Hello! I'd love to help you discover new attractions. What your favorite type of Guided activity?""}, {'assistant': "" I'm planning a trip to CO and I want to find some Guided attractions.""}, {'assistant': "" CO has a lot to offer. Can you tell me more about what you're looking for in a Guided experience?""}, {'assistant': "" I'm planning a trip to CO and I want to find some Guided attractions.""}, {'assistant': """
1,"assistant: Hello! What kind of attractions are you looking for? Are you interested in history, art, or something else?",,"assistant: Hello! What kind of attractions are you looking for? Are you interested in history, art, or something else?",,
1,user: I'm interested in <ATTRACTION_TYPE_1> and <ATTRACTION_TYPE_2> attractions in <STATE_1>.,"attractions = search_attractions(type=[""<ATTRACTION_TYPE_1>"", ""<ATTRACTION_TYPE_2>""], state=""<STATE_1>"")
save_to_cache(key=""attractions"", value=attractions)",user: I'm interested in Art and Scenic attractions in GA.,"attractions = search_attractions(type=[""Art"", ""Scenic""], state=""GA"")
save_to_cache(key=""attractions"", value=attractions)",
1,assistant: <STATE_1> has a lot to offer. Are you looking at specific cities or regions?,,assistant: GA has a lot to offer. Are you looking at specific cities or regions?,,
1,"user: Yeah, I'm thinking of visiting <CITY_2> and <CITY_3>.","attractions = get_results_from_cache(key=""attractions"")
filtered_attractions1 = filter_attractions(prior_results=attractions, city=""<CITY_2>"")
filtered_attractions2 = filter_attractions(prior_results=attractions, city=""<CITY_3>"")
save_to_cache(key=""filtered_attractions1"", value=filtered_attractions1)
save_to_cache(key=""filtered_attractions2"", value=filtered_attractions2)","user: Yeah, I'm thinking of visiting Fresno and Memphis.","attractions = get_results_from_cache(key=""attractions"")
filtered_attractions1 = filter_attractions(prior_results=attractions, city=""Fresno"")
filtered_attractions2 = filter_attractions(prior_results=attractions, city=""Memphis"")
save_to_cache(key=""filtered_attractions1"", value=filtered_attractions1)
save_to_cache(key=""filtered_attractions2"", value=filtered_attractions2)",
1,assistant: Both <CITY_2> and <CITY_3> have great <ATTRACTION_TYPE_1> and <ATTRACTION_TYPE_2> attractions. Let me tell you about some of them.,,assistant: Both Fresno and Memphis have great Art and Scenic attractions. Let me tell you about some of them.,,
1,user: That sounds great.,"filtered_attractions1 = get_results_from_cache(key=""filtered_attractions1"")
filtered_attractions2 = get_results_from_cache(key=""filtered_attractions2"")",user: That sounds great.,"filtered_attractions1 = get_results_from_cache(key=""filtered_attractions1"")
filtered_attractions2 = get_results_from_cache(key=""filtered_attractions2"")"," 'Hello! What kind of attractions are you looking for? Are you interested in history, art, or something else?'}, {'user': "" I'm interested in Art and Scenic attractions in GA.'}, {'assistant':'That sounds great.'}]

# Search Results
{'attractions': SearchResultsOutputModel(search_results=[], query_summary='Attraction search results in GA.'}, 'filtered_attractions1': SearchResultsOutputModel(search_results=[], query_summary='Attraction search results in GA"
2,assistant: Hello! What brings you here today? Are you looking for a quick weekend getaway or a longer vacation?,,assistant: Hello! What brings you here today? Are you looking for a quick weekend getaway or a longer vacation?,,
2,user: I'm planning a trip to <STATE_2> and I want to find some <ATTRACTION_TYPE_1> attractions.,"attractions = search_attractions(state=""<STATE_2>"", type=[""<ATTRACTION_TYPE_1>""])
save_to_cache(key=""attractions"", value=attractions)",user: I'm planning a trip to OR and I want to find some Culinary attractions.,"attractions = search_attractions(state=""OR"", type=[""Culinary""])
save_to_cache(key=""attractions"", value=attractions)",
2,assistant: <STATE_2> has a lot to offer. Are you looking at a specific city or region?,,assistant: OR has a lot to offer. Are you looking at a specific city or region?,,
2,"user: Not really, I'm flexible. What are some popular <ATTRACTION_TYPE_1> spots in <STATE_2>?","attractions = get_results_from_cache(key=""attractions"")","user: Not really, I'm flexible. What are some popular Culinary spots in OR?","attractions = get_results_from_cache(key=""attractions"")",
2,assistant: There are several. Let me see what I can find for you.,,assistant: There are several. Let me see what I can find for you.,,
2,"user: Great, thanks!",,"user: Great, thanks!",,"'Yes, I'm planning a trip to OR and I want to find some Culinary.'}, {'assistant':'There are several. Let me see what I can find for you.'}, {'assistant':'There are several. Let me see what I can find for you.'}, {'assistant':'There are several. Let me see what I can find for you.'}, {'assistant':'There are several. Let me see what I can find for you.'}, {'assistant': '"
3,assistant: Hello! Are you looking for a unique experience? I can help you find some hidden gems in <CITY_2>.,,assistant: Hello! Are you looking for a unique experience? I can help you find some hidden gems in St. Louis.,,
3,"user: Yeah, I'm thinking of visiting some <ATTRACTION_TYPE_2> attractions in <CITY_2>.","attractions = search_attractions(city=""<CITY_2>"", type=[""<ATTRACTION_TYPE_2>""])
save_to_cache(key=""attractions"", value=attractions)","user: Yeah, I'm thinking of visiting some Art attractions in St. Louis.","attractions = search_attractions(city=""St. Louis"", type=[""Art""])
save_to_cache(key=""attractions"", value=attractions)",
3,assistant: <CITY_2> has a lot of great <ATTRACTION_TYPE_2> spots. Have you considered <CITY_2_NEIGHBORHOOD_1>?,,assistant: St. Louis has a lot of great Art spots. Have you considered Downtown St. Louis?,,
3,"user: Actually, I haven't. What's there?","attractions = get_results_from_cache(key=""attractions"")
filtered_attractions = filter_attractions(prior_results=attractions, neighborhood=[""<CITY_2_NEIGHBORHOOD_1>""])
save_to_cache(key=""filtered_attractions"", value=filtered_attractions)","user: Actually, I haven't. What's there?","attractions = get_results_from_cache(key=""attractions"")
filtered_attractions = filter_attractions(prior_results=attractions, neighborhood=[""Downtown St. Louis""])
save_to_cache(key=""filtered_attractions"", value=filtered_attractions)",
3,assistant: It's a great area with a lot of <ATTRACTION_TYPE_2> attractions. I can give you some insider tips.,,assistant: It's a great area with a lot of Art attractions. I can give you some insider tips.,,
3,"user: Okay, that sounds good.",,"user: Okay, that sounds good.",," 'Hello! Are you looking for a unique experience? I can help you find some hidden gems in St. Louis.'}, {'assistant':'St. Louis has a lot of great Art spots. Have you considered Downtown St. Louis?'}, {'assistant':'It's a great area with a lot of Art attractions. I can give you some insider information.'}]

# Search Results
{'attractions': SearchResultsOutputModel(search_results=[{'Unnamed: 0': 658, '"
4,assistant: Hi there! How can I assist you? Are you looking for something historic or modern?,,assistant: Hi there! How can I assist you? Are you looking for something historic or modern?,,
4,user: I'm looking for some <ATTRACTION_TYPE_1> attractions in <CITY_1>.,"attractions = search_attractions(city=""<CITY_1>"", type=[""<ATTRACTION_TYPE_1>""])
save_to_cache(key=""attractions"", value=attractions)",user: I'm looking for some Historical attractions in St. Louis.,"attractions = search_attractions(city=""St. Louis"", type=[""Historical""])
save_to_cache(key=""attractions"", value=attractions)",
4,assistant: We have a lot of great <ATTRACTION_TYPE_1> spots in <CITY_1>. Are you interested in anything specific?,,assistant: We have a lot of great Historical spots in St. Louis. Are you interested in anything specific?,,
4,user: Not really,,user: Not really,,
4,"assistant: Okay, let me give you some recommendations. Have you considered <CITY_1_NEIGHBORHOOD_2>?",,"assistant: Okay, let me give you some recommendations. Have you considered Soulard?",,
4,"user: No, I haven't. What's there?","neighborhood_attractions = filter_attractions(prior_results=get_results_from_cache(key=""attractions""), neighborhood=[""<CITY_1_NEIGHBORHOOD_2>""])
save_to_cache(key=""neighborhood_attractions"", value=neighborhood_attractions)","user: No, I haven't. What's there?","neighborhood_attractions = filter_attractions(prior_results=get_results_from_cache(key=""attractions""), neighborhood=[""Soulard""])
save_to_cache(key=""neighborhood_attractions"", value=neighborhood_attractions)","'I'm looking for some Historical attractions in St. Louis. Are you interested in anything specific?'}, {'assistant':'We have a lot of great Historical spots in St. Louis. Are you looking for something historic or modern?'}, {'assistant':'No, I haven. I'm looking for some Historical attractions in St. Louis. Are you interested in anything specific?'}, {'assistant':'We have a lot of great Historical spots in St. Louis. Are you looking for something historic"
5,assistant: Hi there! How can I assist you? Are you looking for something local or international?,,assistant: Hi there! How can I assist you? Are you looking for something local or international?,,
5,user: I'm looking for some <ATTRACTION_TYPE_2> attractions in <CITY_1>.,"attractions = search_attractions(city=""<CITY_1>"", type=[""<ATTRACTION_TYPE_2>""])
save_to_cache(key=""attractions"", value=attractions)",user: I'm looking for some Scenic attractions in San Jose.,"attractions = search_attractions(city=""San Jose"", type=[""Scenic""])
save_to_cache(key=""attractions"", value=attractions)",
5,assistant: We have a lot of great <ATTRACTION_TYPE_2> spots in <CITY_1>. Are you interested in anything specific?,,assistant: We have a lot of great Scenic spots in San Jose. Are you interested in anything specific?,,
5,user: Not really,"attractions = get_results_from_cache(key=""attractions"")",user: Not really,"attractions = get_results_from_cache(key=""attractions"")",
5,"assistant: Okay, let me give you some recommendations. Have you considered <CITY_1_NEIGHBORHOOD_2>?",,"assistant: Okay, let me give you some recommendations. Have you considered Willow Glen?",,
5,"user: No, I haven't. What's there?","neighborhood_attractions = filter_attractions(prior_results=get_results_from_cache(key=""attractions""), neighborhood=[""<CITY_1_NEIGHBORHOOD_2>""])
save_to_cache(key=""neighborhood_attractions"", value=neighborhood_attractions)","user: No, I haven't. What's there?","neighborhood_attractions = filter_attractions(prior_results=get_results_from_cache(key=""attractions""), neighborhood=[""Willow Glen""])
save_to_cache(key=""neighborhood_attractions"", value=neighborhood_attractions)","'What's there?'}, {'assistant':'We have a lot of great Scenic spots in San Jose. are you interested in anything specific?'}, {'assistant':'We have a lot of great Scenic spots in San Jose. are you interested in anything specific?'}, {'assistant':'Not really.', {'assistant':'We have a lot of great Scenic spots in San Jose. are you interested in anything specific?'}, {'assistant':'Not really.', {'assistant':'We"
6,"assistant: Hi, how can I help you today? Are you looking for a short or long trip?",,"assistant: Hi, how can I help you today? Are you looking for a short or long trip?",,
6,user: I'm looking for <ATTRACTION_TYPE_1> attractions in <STATE_1>.,"attractions = search_attractions(type=[""<ATTRACTION_TYPE_1>""], state=""<STATE_1>"")
save_to_cache(key=""attractions"", value=attractions)",user: I'm looking for Cultural attractions in KY.,"attractions = search_attractions(type=[""Cultural""], state=""KY"")
save_to_cache(key=""attractions"", value=attractions)",
6,assistant: <STATE_1> has a rich history and culture. What specific type of <ATTRACTION_TYPE_1> attractions are you interested in?,,assistant: KY has a rich history and culture. What specific type of Cultural attractions are you interested in?,,
6,"user: I'm not sure, just give me all for now","attractions = get_results_from_cache(key=""attractions"")","user: I'm not sure, just give me all for now","attractions = get_results_from_cache(key=""attractions"")",
6,"assistant: Okay, let me see what I can find for you. Are you open to visiting different cities in <STATE_1>?",,"assistant: Okay, let me see what I can find for you. Are you open to visiting different cities in KY?",,
6,"user: Yes, I am. Infact, I am thinking of going to <CITY_1> for sure.","attractions = get_results_from_cache(key=""attractions"")
filtered_attractions = filter_attractions(prior_results=attractions, city=""<CITY_1>"")
save_to_cache(key=""filtered_attractions"", value=filtered_attractions)","user: Yes, I am. Infact, I am thinking of going to Lexington for sure.","attractions = get_results_from_cache(key=""attractions"")
filtered_attractions = filter_attractions(prior_results=attractions, city=""Lexington"")
save_to_cache(key=""filtered_attractions"", value=filtered_attractions)","'search_results': SearchResultsOutputModel(search_results=[], query_summary='Attraction search results in KY. attraction type(s): [Cultural].', 'latitude': 38.25816667, 'longitude': -85.76005556, 'neighborhood': 'Highlands'}], query_summary='Attraction search results in KY. attraction type(s): [Cultural].', 'latitude': 38.25816667, 'longitude': -85.76005556, 'neighbor"
7,assistant: Hello! How can I assist you?,,assistant: Hello! How can I assist you?,,
7,user: I'm planning a trip to <STATE_1> and I want to find some <ATTRACTION_TYPE_2> attractions.,"attractions = search_attractions(state=""<STATE_1>"", type=[""<ATTRACTION_TYPE_2>""])
save_to_cache(key=""attractions"", value=attractions)",user: I'm planning a trip to CO and I want to find some Scenic attractions.,"attractions = search_attractions(state=""CO"", type=[""Scenic""])
save_to_cache(key=""attractions"", value=attractions)",
7,assistant: <STATE_1> has a lot to offer. Are you looking at a specific city or region?,,assistant: CO has a lot to offer. Are you looking at a specific city or region?,,
7,"user: Not really, I'm flexible. Give me anything","attractions = get_results_from_cache(key=""attractions"")","user: Not really, I'm flexible. Give me anything","attractions = get_results_from_cache(key=""attractions"")",
7,assistant: There are several. Let me see what I can find for you.,,assistant: There are several. Let me see what I can find for you.,,
7,"user: Great, thanks!",,"user: Great, thanks!",," 'The attraction type is a Scenic, and the provided search results. The last turn in the conversation is from the user. 

# CONVERSATION
[{'user': 'I'm planning a trip to CO and I want to find some Scenic attractions.'}, {'assistant':'Hello! How can I assist you?'}, {'assistant':'There are several. Let me see what I can find for you.'}, {'assistant':'I'm planning a trip to CO and I"
8,assistant: Hello! Are you looking for something to do in your free time?,,assistant: Hello! Are you looking for something to do in your free time?,,
8,"user: Yeah, I'm thinking of visiting some <ATTRACTION_TYPE_1> attractions in <CITY_2>.","attractions = search_attractions(city=""<CITY_2>"", type=[""<ATTRACTION_TYPE_1>""])
save_to_cache(key=""attractions"", value=attractions)","user: Yeah, I'm thinking of visiting some Culinary attractions in San Jose.","attractions = search_attractions(city=""San Jose"", type=[""Culinary""])
save_to_cache(key=""attractions"", value=attractions)",
8,assistant: <CITY_2> has a lot of great <ATTRACTION_TYPE_1> spots. Have you considered <CITY_2_NEIGHBORHOOD_1>?,,assistant: San Jose has a lot of great Culinary spots. Have you considered Downtown San Jose?,,
8,"user: Actually, I haven't. What's there?","attractions = get_results_from_cache(key=""attractions"")
filtered_attractions = filter_attractions(prior_results=attractions, neighborhood=[""<CITY_2_NEIGHBORHOOD_1>""])
save_to_cache(key=""filtered_attractions"", value=filtered_attractions)","user: Actually, I haven't. What's there?","attractions = get_results_from_cache(key=""attractions"")
filtered_attractions = filter_attractions(prior_results=attractions, neighborhood=[""Downtown San Jose""])
save_to_cache(key=""filtered_attractions"", value=filtered_attractions)",
8,assistant: It's a great area with a lot of <ATTRACTION_TYPE_1> attractions. I can give you some recommendations.,,assistant: It's a great area with a lot of Culinary attractions. I can give you some recommendations.,,
8,"user: Okay, that sounds good.","filtered_attractions = get_results_from_cache(key=""filtered_attractions"")","user: Okay, that sounds good.","filtered_attractions = get_results_from_cache(key=""filtered_attractions"")","'I've been to. What's there?'}, {'assistant':'What's there?'}, {'assistant':'I've been to. What's there?'}, {'assistant':'What's there?'}, {'assistant':'I've been to. What's there?'}, {'assistant':'What's there?'}, {'assistant':'I've been to. What's there?'}, {'assistant':'What's there?'}, {'assistant':'I've been to. What's"
9,assistant: Hello! Are you looking for something to do in your free time?,,assistant: Hello! Are you looking for something to do in your free time?,,
9,"user: Yeah, I'm thinking of visiting some <ATTRACTION_TYPE_2> attractions in <CITY_2>.","attractions = search_attractions(city=""<CITY_2>"", type=[""<ATTRACTION_TYPE_2>""])
save_to_cache(key=""attractions"", value=attractions)","user: Yeah, I'm thinking of visiting some Cultural attractions in San Jose.","attractions = search_attractions(city=""San Jose"", type=[""Cultural""])
save_to_cache(key=""attractions"", value=attractions)",
9,assistant: <CITY_2> has a lot of great <ATTRACTION_TYPE_2> spots. Have you considered <CITY_2_NEIGHBORHOOD_1>?,,assistant: San Jose has a lot of great Cultural spots. Have you considered Downtown San Jose?,,
9,"user: Actually, I haven't. What's there?","attractions = get_results_from_cache(key=""attractions"")
filtered_attractions = filter_attractions(prior_results=attractions, neighborhood=[""<CITY_2_NEIGHBORHOOD_1>""])
save_to_cache(key=""filtered_attractions"", value=filtered_attractions)","user: Actually, I haven't. What's there?","attractions = get_results_from_cache(key=""attractions"")
filtered_attractions = filter_attractions(prior_results=attractions, neighborhood=[""Downtown San Jose""])
save_to_cache(key=""filtered_attractions"", value=filtered_attractions)",
9,assistant: It's a great area with a lot of <ATTRACTION_TYPE_2> attractions. I can give you some recommendations.,,assistant: It's a great area with a lot of Cultural attractions. I can give you some recommendations.,,
9,"user: Okay, that sounds good.","filtered_attractions = get_results_from_cache(key=""filtered_attractions"")","user: Okay, that sounds good.","filtered_attractions = get_results_from_cache(key=""filtered_attractions"")","'search_results', 'type': 'SearchResultsOutputModel(search_results=[{'Unnamed: 0': 140, 'city': 'San Jose','state': 'CA', 'attraction_name': 'Japanese American Museum of San Jose', 'type': 'Cultural', 'latitude': 37.34754, 'longitude': -121.89347, 'neighborhood': 'Downtown San Jose'}], query_summary='Attraction search results in San Jose. attraction type(s"
10,assistant: Hello! Are you looking for something to do in your free time?,,assistant: Hello! Are you looking for something to do in your free time?,,
10,"user: Yeah, I'm thinking of visiting some <ATTRACTION_TYPE_1> attractions in <CITY_2>.","attractions = search_attractions(city=""<CITY_2>"", type=[""<ATTRACTION_TYPE_1>""])
save_to_cache(key=""attractions"", value=attractions)","user: Yeah, I'm thinking of visiting some Scenic attractions in St. Louis.","attractions = search_attractions(city=""St. Louis"", type=[""Scenic""])
save_to_cache(key=""attractions"", value=attractions)",
10,assistant: <CITY_2> has a lot of great <ATTRACTION_TYPE_1> spots. Have you considered <CITY_2_NEIGHBORHOOD_1>?,,assistant: St. Louis has a lot of great Scenic spots. Have you considered Downtown St. Louis?,,
10,"user: Actually, I haven't. What's there?","attractions = get_results_from_cache(key=""attractions"")
filtered_attractions = filter_attractions(prior_results=attractions, neighborhood=[""<CITY_2_NEIGHBORHOOD_1>""])
save_to_cache(key=""filtered_attractions"", value=filtered_attractions)","user: Actually, I haven't. What's there?","attractions = get_results_from_cache(key=""attractions"")
filtered_attractions = filter_attractions(prior_results=attractions, neighborhood=[""Downtown St. Louis""])
save_to_cache(key=""filtered_attractions"", value=filtered_attractions)",
10,assistant: It's a great area with a lot of <ATTRACTION_TYPE_1> attractions. I can give you some recommendations.,,assistant: It's a great area with a lot of Scenic attractions. I can give you some recommendations.,,
10,"user: Okay, that sounds good.","attractions = get_results_from_cache(key=""attractions"")","user: Okay, that sounds good.","attractions = get_results_from_cache(key=""attractions"")"," ""SearchResultsOutputModel(search_results=[], query_summary='Attraction search results in St. Louis. attraction type(s): [Scenic].\n\nAdditionally filtering for neighborhood(s): [Downtown St. Louis].')}

assistant: ""SearchResultsOutputModel(search_results=[], query_summary='Attraction search results in St. Louis. attraction type(s): [Scenic].\n\nAdditionally filtering for neighborhood(s): [Downtown St. Louis].']}

assistant: ""SearchResultsOutput"
11,assistant: Hi there! How can I assist you?,,assistant: Hi there! How can I assist you?,,
11,user: I'm looking for some <ATTRACTION_TYPE_1> attractions in <CITY_1>.,"attractions = search_attractions(city=""<CITY_1>"", type=[""<ATTRACTION_TYPE_1>""])
save_to_cache(key=""attractions"", value=attractions)",user: I'm looking for some Guided attractions in Atlanta.,"attractions = search_attractions(city=""Atlanta"", type=[""Guided""])
save_to_cache(key=""attractions"", value=attractions)",
11,assistant: We have a lot of great <ATTRACTION_TYPE_1> spots in <CITY_1>. Are you interested in anything specific?,,assistant: We have a lot of great Guided spots in Atlanta. Are you interested in anything specific?,,
11,"user: Not really, just something fun.","attractions = get_results_from_cache(key=""attractions"")","user: Not really, just something fun.","attractions = get_results_from_cache(key=""attractions"")",
11,"assistant: Okay, let me give you some recommendations. Have you considered <CITY_1_NEIGHBORHOOD_2>?",,"assistant: Okay, let me give you some recommendations. Have you considered Buckhead?",,
11,"user: No, I haven't. What's there?","attractions = get_results_from_cache(key=""attractions"")
filtered_attractions = filter_attractions(prior_results=attractions, neighborhood=[""<CITY_1_NEIGHBORHOOD_2>""])
save_to_cache(key=""filtered_attractions"", value=filtered_attractions)","user: No, I haven't. What's there?","attractions = get_results_from_cache(key=""attractions"")
filtered_attractions = filter_attractions(prior_results=attractions, neighborhood=[""Buckhead""])
save_to_cache(key=""filtered_attractions"", value=filtered_attractions)","'We have a lot of great Guided spots in Atlanta. Are you interested in anything specific?'}, {'assistant':'We have a lot of great Guided spots in Atlanta. Are you interested in anything specific?'}, {'assistant':'Not really, just something.'}, {'assistant':'Okay, let me give you some recommendations. Have you considered Buckhead.'}, {'assistant':'We have a lot of great Guided spots in Atlanta. Are you interested in anything specific?'},"
12,assistant: Hello! What brings you here today?,,assistant: Hello! What brings you here today?,,
12,user: I'm planning a trip to <STATE_2> and I want to find some <ATTRACTION_TYPE_1> and <ATTRACTION_TYPE_2> attractions.,"attractions = search_attractions(state=""<STATE_2>"", type=[""<ATTRACTION_TYPE_1>"", ""<ATTRACTION_TYPE_2>""])
save_to_cache(key=""attractions"", value=attractions)",user: I'm planning a trip to AZ and I want to find some Culinary and Touristy attractions.,"attractions = search_attractions(state=""AZ"", type=[""Culinary"", ""Touristy""])
save_to_cache(key=""attractions"", value=attractions)",
12,assistant: <STATE_2> has a lot to offer. Are you looking at a specific city or region?,,assistant: AZ has a lot to offer. Are you looking at a specific city or region?,,
12,"user: Not really, I'm flexible.",,"user: Not really, I'm flexible.",,
12,assistant: Anything else I can help you with,,assistant: Anything else I can help you with,,
